House status,Name,Price,Street Address,Locality,Region,PostalCode,Size,Href
New construction,"Two Plan, Prato In The Village At Castle Pines, Castle Rock, CO 80108","$1,200,000 ","Two Plan, Prato in the Village at Castle Pines",Castle Rock,CO,80108,"4,222",https://www.zillow.com/community/prato-in-village-at-castle-pines/2079153618_zpid/
New construction,"Superhome Plan, Castle Valley : The Grand Collection, Castle Pines, CO 80108","$747,900 ","SuperHome Plan, Castle Valley : The Grand Collection",Castle Pines,CO,80108,"4,122",https://www.zillow.com/community/castle-valley-grand-collection/2088385327_zpid/
New construction,"Rembrandt (Residence 60254) Plan, Skyline Ridge At Castle Pines, Castle Rock, CO 80108","$804,990 ","Rembrandt (Residence 60254) Plan, Skyline Ridge at Castle Pines",Castle Rock,CO,80108,"4,113",https://www.zillow.com/community/skyline-ridge-at-castle-pines/2080665114_zpid/
New construction,"4072 Emerson Plan, Gallery At The Canyons, Castle Pines, CO 80108","$574,990 ","4072 Emerson Plan, Gallery at The Canyons",Castle Pines,CO,80108,"2,691",https://www.zillow.com/community/gallery-at-canyons/2082420505_zpid/
New construction,"Huntington Plan, Castle Valley : The Monarch Collection, Castle Pines, CO 80108","$629,900 ","Huntington Plan, Castle Valley : The Monarch Collection",Castle Pines,CO,80108,"3,083",https://www.zillow.com/community/castle-valley-monarch-collection/2088385336_zpid/
New construction,"Crawford Plan, Overlook At Ravenwood, Castle Rock, CO 80108","$590,990 ","CRAWFORD Plan, Overlook at Ravenwood",Castle Rock,CO,80108,"3,148",https://www.zillow.com/community/overlook-at-ravenwood/2079682358_zpid/
New construction,"Residence 4503 Plan, Solis At The Canyons, Castle Rock, CO 80108","$659,900 ","Residence 4503 Plan, Solis at The Canyons",Castle Rock,CO,80108,"3,220",https://www.zillow.com/community/solis-at-canyons/2079528509_zpid/
New construction,"5075 Hyde Plan, Luxe At The Canyons, Castle Pines, CO 80108","$824,090 ","5075 Hyde Plan, Luxe at The Canyons",Castle Pines,CO,80108,"4,444",https://www.zillow.com/community/luxe-at-canyons/2082420498_zpid/
New construction,"Cortez Plan, Timberline City Collection, Castle Pines, CO 80108","$514,990 ","Cortez Plan, Timberline City Collection",Castle Pines,CO,80108,"2,264",https://www.zillow.com/community/timberline-city-collection/2081394192_zpid/
New construction,"Delaney Plan, The Landing At Cobblestone Ranch, Castle Rock, CO 80108","$504,950 ","Delaney Plan, The Landing at Cobblestone Ranch",Castle Rock,CO,80108,"2,370",https://www.zillow.com/community/landing-at-cobblestone-ranch/2078648479_zpid/
House for sale,"1749 Stable View Dr, Castle Pines, CO 80108","$516,798 ",1749 Stable View Dr,Castle Pines,CO,80108,"2,424",https://www.zillow.com/homedetails/1749-Stable-View-Dr-Castle-Pines-CO-80108/300015206_zpid/
House for sale,"1751 Stable View Dr, Castle Pines, CO 80108","$582,882 ",1751 Stable View Dr,Castle Pines,CO,80108,"2,636",https://www.zillow.com/homedetails/1751-Stable-View-Dr-Castle-Pines-CO-80108/300014812_zpid/
New construction,"Residence 3504 Plan, Prelude Collection In Ravenwood Village At Terrain, Castle Rock, CO 80108","$444,900 ","Residence 3504 Plan, Prelude Collection in Ravenwood Village at Terrain",Castle Rock,CO,80108,"2,555",https://www.zillow.com/community/prelude-collection-in-ravenwood-village-at-terrain/2081043531_zpid/
New construction,"5081 Sanctuary Plan, Retreat At The Canyons, Castle Rock, CO 80108","$629,900 ","5081 Sanctuary Plan, Retreat at The Canyons",Castle Rock,CO,80108,"2,369",https://www.zillow.com/community/retreat-at-canyons/2078140814_zpid/
House for sale,"742 Norwich Ct, Castle Pines, CO 80108","$765,000 ",742 Norwich Ct,Castle Pines,CO,80108,"5,119",https://www.zillow.com/homedetails/742-Norwich-Ct-Castle-Pines-CO-80108/13482226_zpid/
New construction,"Plan 1887 Plan, The Canyons - Classic Collection, Castle Rock, CO 80108","$499,900 ","Plan 1887 Plan, The Canyons - Classic Collection",Castle Rock,CO,80108,"1,902",https://www.zillow.com/community/canyons-classic-collection/2079556903_zpid/
New construction,"4074 Corbett Plan, Gallery At The Canyons, Castle Pines, CO 80108","$623,990 ","4074 Corbett Plan, Gallery at The Canyons",Castle Pines,CO,80108,"2,931",https://www.zillow.com/community/gallery-at-canyons/2082420507_zpid/
New construction,"Residence One Plan, The Canyons By Berkeley Homes, Castle Pines, CO 80108","$484,900 ","Residence One Plan, The Canyons by Berkeley Homes",Castle Pines,CO,80108,"1,674",https://www.zillow.com/community/canyons-by-berkeley-homes/2081542820_zpid/
New construction,"Decker Plan, The Reserve At Cobblestone Ranch, Castle Rock, CO 80108","$449,950 ","Decker Plan, The Reserve at Cobblestone Ranch",Castle Rock,CO,80108,"2,000",https://www.zillow.com/community/reserve-at-cobblestone-ranch/2078677136_zpid/
New construction,"Columbine Plan, Timberline Destination Collection, Castle Pines, CO 80108","$596,990 ","Columbine Plan, Timberline Destination Collection",Castle Pines,CO,80108,"2,404",https://www.zillow.com/community/timberline-destination-collection/2081394189_zpid/
New construction,"2011 Pinion Wing Cir, Castle Rock, CO 80108","$600,000 ",2011 Pinion Wing Cir,Castle Rock,CO,80108,"3,090",https://www.zillow.com/homedetails/2011-Pinion-Wing-Cir-Castle-Rock-CO-80108/245221263_zpid/
New construction,"Branson Plan, Overlook At Ravenwood, Castle Rock, CO 80108","$561,990 ","BRANSON Plan, Overlook at Ravenwood",Castle Rock,CO,80108,"2,702",https://www.zillow.com/community/overlook-at-ravenwood/2079682357_zpid/
New construction,"The Genesee Plan, Castle Valley: The Town Collection, Castle Pines, CO 80108","$449,990 ","The Genesee Plan, Castle Valley: The Town Collection",Castle Pines,CO,80108,"2,135",https://www.zillow.com/community/castle-valley-town-collection/2086501665_zpid/
New construction,"7193 Bedlam Dr, Castle Pines, CO 80108","$457,660 ",7193 Bedlam Dr,Castle Pines,CO,80108,"1,620",https://www.zillow.com/homedetails/7193-Bedlam-Dr-Castle-Pines-CO-80108/249983206_zpid/
New construction,"7199 Bedlam Dr, Castle Pines, CO 80108","$487,570 ",7199 Bedlam Dr,Castle Pines,CO,80108,"1,920",https://www.zillow.com/homedetails/7199-Bedlam-Dr-Castle-Pines-CO-80108/249983618_zpid/
New construction,"7189 Bedlam Dr, Castle Pines, CO 80108","$468,660 ",7189 Bedlam Dr,Castle Pines,CO,80108,"1,773",https://www.zillow.com/homedetails/7189-Bedlam-Dr-Castle-Pines-CO-80108/249983665_zpid/
House for sale,"6723 Esmeralda Dr, Castle Rock, CO 80108","$699,900 ",6723 Esmeralda Dr,Castle Rock,CO,80108,"6,617",https://www.zillow.com/homedetails/6723-Esmeralda-Dr-Castle-Rock-CO-80108/108264797_zpid/
New construction,"Residence 3505 Plan, Prelude Collection In Ravenwood Village At Terrain, Castle Rock, CO 80108","$454,900 ","Residence 3505 Plan, Prelude Collection in Ravenwood Village at Terrain",Castle Rock,CO,80108,"2,788",https://www.zillow.com/community/prelude-collection-in-ravenwood-village-at-terrain/2081043527_zpid/
New construction,"Kipling (Residence 40223) Plan, Skyline Ridge At Castle Pines, Castle Rock, CO 80108","$540,990 ","Kipling (Residence 40223) Plan, Skyline Ridge at Castle Pines",Castle Rock,CO,80108,"2,149",https://www.zillow.com/community/skyline-ridge-at-castle-pines/2080665111_zpid/
New construction,"Silverleaf Plan, Castle Valley : The Grand Collection, Castle Rock, CO 80108","$676,900 ","Silverleaf Plan, Castle Valley : The Grand Collection",Castle Rock,CO,80108,"3,001",https://www.zillow.com/community/castle-valley-grand-collection/2088385328_zpid/
New construction,"4075 Zolla Plan, Gallery At The Canyons, Castle Pines, CO 80108","$655,990 ","4075 Zolla Plan, Gallery at The Canyons",Castle Pines,CO,80108,"3,203",https://www.zillow.com/community/gallery-at-canyons/2082420504_zpid/
New construction,"Stonehaven Plan, Castle Valley : The Monarch Collection, Castle Pines, CO 80108","$615,900 ","Stonehaven Plan, Castle Valley : The Monarch Collection",Castle Pines,CO,80108,"2,763",https://www.zillow.com/community/castle-valley-monarch-collection/2088385335_zpid/
New construction,"Hanford Plan, The Landing At Cobblestone Ranch, Castle Rock, CO 80108","$594,950 ","Hanford Plan, The Landing at Cobblestone Ranch",Castle Rock,CO,80108,"2,990",https://www.zillow.com/community/landing-at-cobblestone-ranch/2078648476_zpid/
New construction,"5074 Stonehaven Plan, Luxe At The Canyons, Castle Pines, CO 80108","$779,090 ","5074 Stonehaven Plan, Luxe at The Canyons",Castle Pines,CO,80108,"3,923",https://www.zillow.com/community/luxe-at-canyons/2082420500_zpid/
New construction,"7194 Finsberry Way, Castle Pines, CO 80108","$459,990 ",7194 Finsberry Way,Castle Pines,CO,80108,"1,773",https://www.zillow.com/homedetails/7194-Finsberry-Way-Castle-Pines-CO-80108/249985135_zpid/
House for sale,"983 Glen Oaks Ave, Castle Pines, CO 80108","$985,000 ",983 Glen Oaks Ave,Castle Pines,CO,80108,"6,190",https://www.zillow.com/homedetails/983-Glen-Oaks-Ave-Castle-Pines-CO-80108/13481860_zpid/
New construction,"Residence 3502 Plan, Prelude Collection In Ravenwood Village At Terrain, Castle Rock, CO 80108","$418,900 ","Residence 3502 Plan, Prelude Collection in Ravenwood Village at Terrain",Castle Rock,CO,80108,"2,239",https://www.zillow.com/community/prelude-collection-in-ravenwood-village-at-terrain/2081043529_zpid/
New construction,"Wellington Plan, Castle Valley : The Grand Collection, Castle Pines, CO 80108","$686,900 ","Wellington Plan, Castle Valley : The Grand Collection",Castle Pines,CO,80108,"2,737",https://www.zillow.com/community/castle-valley-grand-collection/2088385326_zpid/
New construction,"Plan 1789 Plan, The Canyons - Ranch Villa Collection, Castle Rock, CO 80108","$475,500 ","Plan 1789 Plan, The Canyons - Ranch Villa Collection",Castle Rock,CO,80108,"1,790",https://www.zillow.com/community/canyons-ranch-villa-collection/2079733376_zpid/
House for sale,"18 Borealis Way, Castle Rock, CO 80108","$5,500,000 ",18 Borealis Way,Castle Rock,CO,80108,"15,212",https://www.zillow.com/homedetails/18-Borealis-Way-Castle-Rock-CO-80108/13483625_zpid/
New construction,"Glenwood Plan, Timberline City Collection, Castle Pines, CO 80108","$534,990 ","Glenwood Plan, Timberline City Collection",Castle Pines,CO,80108,"2,576",https://www.zillow.com/community/timberline-city-collection/2081394193_zpid/
New construction,"Trevino Plan, Castle Valley : The Legends Collection, Castle Pines, CO 80108","$842,900 ","Trevino Plan, Castle Valley : The Legends Collection",Castle Pines,CO,80108,"3,450",https://www.zillow.com/community/castle-valley-legends-collection/2081248422_zpid/
New construction,"Yale (Residence 50151) Plan, Skyline Ridge At Castle Pines, Castle Rock, CO 80108","$572,990 ","Yale (Residence 50151) Plan, Skyline Ridge at Castle Pines",Castle Rock,CO,80108,"2,187",https://www.zillow.com/community/skyline-ridge-at-castle-pines/2080665106_zpid/
New construction,"Plan 1738 Modeled Plan, The Canyons - Ranch Villa Collection, Castle Rock, CO 80108","$475,500 ","Plan 1738 Modeled Plan, The Canyons - Ranch Villa Collection",Castle Rock,CO,80108,"1,738",https://www.zillow.com/community/canyons-ranch-villa-collection/2079733379_zpid/
New construction,"Doyle (Residence 40120) Plan, Skyline Ridge At Castle Pines, Castle Rock, CO 80108","$505,990 ","Doyle (Residence 40120) Plan, Skyline Ridge at Castle Pines",Castle Rock,CO,80108,"1,673",https://www.zillow.com/community/skyline-ridge-at-castle-pines/2080665115_zpid/
New construction,"Plan 2412 Plan, The Canyons - Classic Collection, Castle Rock, CO 80108","$517,900 ","Plan 2412 Plan, The Canyons - Classic Collection",Castle Rock,CO,80108,"2,480",https://www.zillow.com/community/canyons-classic-collection/2079733344_zpid/
New construction,"The Buena Vista Plan, Castle Valley: The Town Collection, Castle Pines, CO 80108","$425,990 ","The Buena Vista Plan, Castle Valley: The Town Collection",Castle Pines,CO,80108,"1,620",https://www.zillow.com/community/castle-valley-town-collection/2086501668_zpid/
New construction,"Plan 1498 Modeled Plan, The Canyons - Ranch Villa Collection, Castle Rock, CO 80108","$449,900 ","Plan 1498 Modeled Plan, The Canyons - Ranch Villa Collection",Castle Rock,CO,80108,"1,477",https://www.zillow.com/community/canyons-ranch-villa-collection/2079733375_zpid/
New construction,"Prescott Plan, The Landing At Cobblestone Ranch, Castle Rock, CO 80108","$595,950 ","Prescott Plan, The Landing at Cobblestone Ranch",Castle Rock,CO,80108,"2,520",https://www.zillow.com/community/landing-at-cobblestone-ranch/2078648483_zpid/
New construction,"Julesburg Plan, Ravenwood At Terrain, Castle Rock, CO 80108","$551,990 ","JULESBURG Plan, Ravenwood at Terrain",Castle Rock,CO,80108,"2,343",https://www.zillow.com/community/ravenwood-at-terrain/2082905751_zpid/
New construction,"5072 Stratton Plan, Luxe At The Canyons, Castle Pines, CO 80108","$718,090 ","5072 Stratton Plan, Luxe at The Canyons",Castle Pines,CO,80108,"3,705",https://www.zillow.com/community/luxe-at-canyons/2082420501_zpid/
New construction,"Monet (Residence 60150) Plan, Skyline Ridge At Castle Pines, Castle Rock, CO 80108","$709,990 ","Monet (Residence 60150) Plan, Skyline Ridge at Castle Pines",Castle Rock,CO,80108,"2,855",https://www.zillow.com/community/skyline-ridge-at-castle-pines/2080665103_zpid/
House for sale,"4340 Chateau Ridge Rd, Castle Rock, CO 80108","$849,000 ",4340 Chateau Ridge Rd,Castle Rock,CO,80108,"4,071",https://www.zillow.com/homedetails/4340-Chateau-Ridge-Rd-Castle-Rock-CO-80108/121866893_zpid/
New construction,"Residence Two Plan, The Canyons By Berkeley Homes, Castle Pines, CO 80108","$494,900 ","Residence Two Plan, The Canyons by Berkeley Homes",Castle Pines,CO,80108,"1,754",https://www.zillow.com/community/canyons-by-berkeley-homes/2081542818_zpid/
New construction,"5086 Haven Plan, Retreat At The Canyons, Castle Rock, CO 80108","$734,900 ","5086 Haven Plan, Retreat at The Canyons",Castle Rock,CO,80108,"2,927",https://www.zillow.com/community/retreat-at-canyons/2078902174_zpid/
New construction,"Hemingway Plan, The Landing At Cobblestone Ranch, Castle Rock, CO 80108","$498,950 ","Hemingway Plan, The Landing at Cobblestone Ranch",Castle Rock,CO,80108,"2,490",https://www.zillow.com/community/landing-at-cobblestone-ranch/2078648474_zpid/
New construction,"Ashbrook I Plan, Castle Valley : The Monarch Collection, Castle Rock, CO 80108","$598,900 ","Ashbrook I Plan, Castle Valley : The Monarch Collection",Castle Rock,CO,80108,"2,574",https://www.zillow.com/community/castle-valley-monarch-collection/2082684323_zpid/
New construction,"Copper Plan, Timberline Destination Collection, Castle Pines, CO 80108","$636,990 ","Copper Plan, Timberline Destination Collection",Castle Pines,CO,80108,"3,250",https://www.zillow.com/community/timberline-destination-collection/2081394188_zpid/
New construction,"Melody Plan, The Landing At Cobblestone Ranch, Castle Rock, CO 80108","$555,950 ","Melody Plan, The Landing at Cobblestone Ranch",Castle Rock,CO,80108,"2,320",https://www.zillow.com/community/landing-at-cobblestone-ranch/2078648477_zpid/
New construction,"Branson Plan, Ravenwood At Terrain, Castle Rock, CO 80108","$561,990 ","BRANSON Plan, Ravenwood at Terrain",Castle Rock,CO,80108,"2,702",https://www.zillow.com/community/ravenwood-at-terrain/2078584216_zpid/
New construction,"Columbia (Residence 50152) Plan, Skyline Ridge At Castle Pines, Castle Rock, CO 80108","$612,990 ","Columbia (Residence 50152) Plan, Skyline Ridge at Castle Pines",Castle Rock,CO,80108,"2,515",https://www.zillow.com/community/skyline-ridge-at-castle-pines/2080665108_zpid/
New construction,"5071 Belcourt Plan, Luxe At The Canyons, Castle Pines, CO 80108","$705,690 ","5071 Belcourt Plan, Luxe at The Canyons",Castle Pines,CO,80108,"2,825",https://www.zillow.com/community/luxe-at-canyons/2082420499_zpid/
New construction,"Prescott Plan, Castle Valley : The Grand Collection, Castle Pines, CO 80108","$716,900 ","Prescott Plan, Castle Valley : The Grand Collection",Castle Pines,CO,80108,"3,498",https://www.zillow.com/community/castle-valley-grand-collection/2088385329_zpid/
New construction,"Haswell Plan, Overlook At Ravenwood, Castle Rock, CO 80108","$542,990 ","HASWELL Plan, Overlook at Ravenwood",Castle Rock,CO,80108,"2,272",https://www.zillow.com/community/overlook-at-ravenwood/2079682355_zpid/
House for sale,"6902 Sulfur Ln, Castle Rock, CO 80108","$800,000 ",6902 Sulfur Ln,Castle Rock,CO,80108,"6,612",https://www.zillow.com/homedetails/6902-Sulfur-Ln-Castle-Rock-CO-80108/82030865_zpid/
House for sale,"1015 Pinefield Ln, Castle Pines, CO 80108","$1,089,000 ",1015 Pinefield Ln,Castle Pines,CO,80108,"5,074",https://www.zillow.com/homedetails/1015-Pinefield-Ln-Castle-Pines-CO-80108/13482896_zpid/
New construction,"The Nederland Plan, Castle Valley: The Town Collection, Castle Pines, CO 80108","$455,990 ","The Nederland Plan, Castle Valley: The Town Collection",Castle Pines,CO,80108,"2,014",https://www.zillow.com/community/castle-valley-town-collection/2086501666_zpid/
New construction,"6552 Merrimack Dr, Castle Pines, CO 80108","$629,990 ",6552 Merrimack Dr,Castle Pines,CO,80108,"2,964",https://www.zillow.com/homedetails/6552-Merrimack-Dr-Castle-Pines-CO-80108/300006764_zpid/
New construction,"Daniel Plan, The Reserve At Cobblestone Ranch, Castle Rock, CO 80108","$470,950 ","Daniel Plan, The Reserve at Cobblestone Ranch",Castle Rock,CO,80108,"2,320",https://www.zillow.com/community/reserve-at-cobblestone-ranch/2078677132_zpid/
House for sale,"7115 Parkwood Ln, Castle Pines, CO 80108","$1,500,000 ",7115 Parkwood Ln,Castle Pines,CO,80108,"5,846",https://www.zillow.com/homedetails/7115-Parkwood-Ln-Castle-Pines-CO-80108/13482974_zpid/
New construction,"Bronte (Residence 40224) Plan, Skyline Ridge At Castle Pines, Castle Rock, CO 80108","$560,990 ","Bronte (Residence 40224) Plan, Skyline Ridge at Castle Pines",Castle Rock,CO,80108,"2,534",https://www.zillow.com/community/skyline-ridge-at-castle-pines/2080665104_zpid/
House for sale,"149 W Juan Way, Castle Rock, CO 80108","$1,125,000 ",149 W Juan Way,Castle Rock,CO,80108,"4,049",https://www.zillow.com/homedetails/149-W-Juan-Way-Castle-Rock-CO-80108/2078190019_zpid/
House for sale,"6388 Agave Ave, Castle Rock, CO 80108","$579,500 ",6388 Agave Ave,Castle Rock,CO,80108,"3,884",https://www.zillow.com/homedetails/6388-Agave-Ave-Castle-Rock-CO-80108/249986000_zpid/
New construction,"Matisse (Residence 60253) Plan, Skyline Ridge At Castle Pines, Castle Rock, CO 80108","$774,990 ","Matisse (Residence 60253) Plan, Skyline Ridge at Castle Pines",Castle Rock,CO,80108,"3,652",https://www.zillow.com/community/skyline-ridge-at-castle-pines/2080665110_zpid/
New construction,"Holbrook Plan, The Landing At Cobblestone Ranch, Castle Rock, CO 80108","$604,950 ","Holbrook Plan, The Landing at Cobblestone Ranch",Castle Rock,CO,80108,"3,190",https://www.zillow.com/community/landing-at-cobblestone-ranch/2078648482_zpid/
New construction,"Hopewell Plan, The Landing At Cobblestone Ranch, Castle Rock, CO 80108","$506,950 ","Hopewell Plan, The Landing at Cobblestone Ranch",Castle Rock,CO,80108,"2,650",https://www.zillow.com/community/landing-at-cobblestone-ranch/2078648468_zpid/
House for sale,"1358 Galactic Pl, Castle Rock, CO 80108","$555,000 ",1358 Galactic Pl,Castle Rock,CO,80108,"4,636",https://www.zillow.com/homedetails/1358-Galactic-Pl-Castle-Rock-CO-80108/82026298_zpid/
New construction,"Dillon Plan, Timberline City Collection, Castle Pines, CO 80108","$504,990 ","Dillon Plan, Timberline City Collection",Castle Pines,CO,80108,"1,920",https://www.zillow.com/community/timberline-city-collection/2081394195_zpid/
House for sale,"7378 Geode Ct, Castle Rock, CO 80108","$565,000 ",7378 Geode Ct,Castle Rock,CO,80108,"4,188",https://www.zillow.com/homedetails/7378-Geode-Ct-Castle-Rock-CO-80108/67451749_zpid/
House for sale,"2145 Beechnut Pl, Castle Rock, CO 80108","$1,595,000 ",2145 Beechnut Pl,Castle Rock,CO,80108,"6,890",https://www.zillow.com/homedetails/2145-Beechnut-Pl-Castle-Rock-CO-80108/82025999_zpid/
Condo for sale,"1418 Pineridge Ln, Castle Pines, CO 80108","$479,000 ",1418 Pineridge Ln,Castle Pines,CO,80108,"3,170",https://www.zillow.com/homedetails/1418-Pineridge-Ln-Castle-Pines-CO-80108/55814102_zpid/
Auction,"7289 Grady Cir, Castle Rock, CO 80108",,7289 Grady Cir,Castle Rock,CO,80108,"2,847",https://www.zillow.com/homedetails/7289-Grady-Cir-Castle-Rock-CO-80108/82020328_zpid/
New construction,"1681 Pinion Wing Cir, Castle Rock, CO 80108","$610,505 ",1681 Pinion Wing Cir,Castle Rock,CO,80108,"2,343",https://www.zillow.com/homedetails/1681-Pinion-Wing-Cir-Castle-Rock-CO-80108/245221480_zpid/
Condo for sale,"6021 Castlegate Dr Unit E33, Castle Rock, CO 80108","$280,000 ",6021 Castlegate Dr UNIT E33,Castle Rock,CO,80108,"1,208",https://www.zillow.com/homedetails/6021-Castlegate-Dr-UNIT-E33-Castle-Rock-CO-80108/2078298257_zpid/
House for sale,"326 E Oak Hills Dr, Castle Rock, CO 80108","$1,688,888 ",326 E Oak Hills Dr,Castle Rock,CO,80108,"6,484",https://www.zillow.com/homedetails/326-E-Oak-Hills-Dr-Castle-Rock-CO-80108/13463613_zpid/
House for sale,"7040 Azurite Ct, Castle Rock, CO 80108","$1,099,000 ",7040 Azurite Ct,Castle Rock,CO,80108,"7,474",https://www.zillow.com/homedetails/7040-Azurite-Ct-Castle-Rock-CO-80108/81772901_zpid/
House for sale,"9424 N Palomino Dr, Castle Rock, CO 80108","$730,000 ",9424 N Palomino Dr,Castle Rock,CO,80108,"2,744",https://www.zillow.com/homedetails/9424-N-Palomino-Dr-Castle-Rock-CO-80108/2078329609_zpid/
House for sale,"6749 Mentha Dr, Castle Rock, CO 80108","$764,900 ",6749 Mentha Dr,Castle Rock,CO,80108,"4,619",https://www.zillow.com/homedetails/6749-Mentha-Dr-Castle-Rock-CO-80108/300006389_zpid/
House for sale,"911 Bramblewood Dr, Castle Pines, CO 80108","$549,900 ",911 Bramblewood Dr,Castle Pines,CO,80108,"3,970",https://www.zillow.com/homedetails/911-Bramblewood-Dr-Castle-Pines-CO-80108/52458880_zpid/
House for sale,"1076 Deer Clover Way, Castle Pines, CO 80108","$534,900 ",1076 Deer Clover Way,Castle Pines,CO,80108,"2,742",https://www.zillow.com/homedetails/1076-Deer-Clover-Way-Castle-Pines-CO-80108/13482858_zpid/
Condo for sale,"2515 Cutters Cir Apt 103, Castle Rock, CO 80108","$319,900 ",2515 Cutters Cir APT 103,Castle Rock,CO,80108,"1,903",https://www.zillow.com/homedetails/2515-Cutters-Cir-APT-103-Castle-Rock-CO-80108/67454375_zpid/
House for sale,"1312 Forest Trails Dr, Castle Pines, CO 80108","$825,000 ",1312 Forest Trails Dr,Castle Pines,CO,80108,"4,750",https://www.zillow.com/homedetails/1312-Forest-Trails-Dr-Castle-Pines-CO-80108/13482998_zpid/
House for sale,"8429 Winter Berry Dr, Castle Pines, CO 80108","$715,000 ",8429 Winter Berry Dr,Castle Pines,CO,80108,"5,507",https://www.zillow.com/homedetails/8429-Winter-Berry-Dr-Castle-Pines-CO-80108/52458840_zpid/
New construction,"Daniel Plan, The Landing At Cobblestone Ranch, Castle Rock, CO 80108","$499,950 ","Daniel Plan, The Landing at Cobblestone Ranch",Castle Rock,CO,80108,"2,320",https://www.zillow.com/community/landing-at-cobblestone-ranch/2078648478_zpid/
House for sale,"6734 Solana Dr, Castle Pines, CO 80108","$539,900 ",6734 Solana Dr,Castle Pines,CO,80108,"4,497",https://www.zillow.com/homedetails/6734-Solana-Dr-Castle-Pines-CO-80108/52458380_zpid/
House for sale,"6157 Massive Peak Loop, Castle Rock, CO 80108","$1,850,000 ",6157 Massive Peak Loop,Castle Rock,CO,80108,"8,508",https://www.zillow.com/homedetails/6157-Massive-Peak-Loop-Castle-Rock-CO-80108/67450957_zpid/
House for sale,"7 Tauber Dr, Castle Pines, CO 80108","$675,000 ",7 Tauber Dr,Castle Pines,CO,80108,"4,260",https://www.zillow.com/homedetails/7-Tauber-Dr-Castle-Pines-CO-80108/13463432_zpid/
New construction,"Arvada Plan, Overlook At Ravenwood, Castle Rock, CO 80108","$571,990 ","ARVADA Plan, Overlook at Ravenwood",Castle Rock,CO,80108,"2,897",https://www.zillow.com/community/overlook-at-ravenwood/2079682356_zpid/
New construction,"Renoir (Residence 60252) Plan, Skyline Ridge At Castle Pines, Castle Rock, CO 80108","$744,990 ","Renoir (Residence 60252) Plan, Skyline Ridge at Castle Pines",Castle Rock,CO,80108,"3,367",https://www.zillow.com/community/skyline-ridge-at-castle-pines/2080665102_zpid/
House for sale,"3205 Country Club Pkwy, Castle Rock, CO 80108","$760,000 ",3205 Country Club Pkwy,Castle Rock,CO,80108,"3,742",https://www.zillow.com/homedetails/3205-Country-Club-Pkwy-Castle-Rock-CO-80108/13483941_zpid/
House for sale,"279 Clare Dr, Castle Pines, CO 80108","$650,000 ",279 Clare Dr,Castle Pines,CO,80108,"3,600",https://www.zillow.com/homedetails/279-Clare-Dr-Castle-Pines-CO-80108/13482572_zpid/
New construction,"1548 Wingfeather Ln, Castle Rock, CO 80108","$647,940 ",1548 Wingfeather Ln,Castle Rock,CO,80108,"3,148",https://www.zillow.com/homedetails/1548-Wingfeather-Ln-Castle-Rock-CO-80108/245221471_zpid/
House for sale,"880 Wolverine Ct, Castle Rock, CO 80108","$1,175,000 ",880 Wolverine Ct,Castle Rock,CO,80108,"5,485",https://www.zillow.com/homedetails/880-Wolverine-Ct-Castle-Rock-CO-80108/13483082_zpid/
House for sale,"6802 Esmeralda Dr, Castle Rock, CO 80108","$609,000 ",6802 Esmeralda Dr,Castle Rock,CO,80108,"4,427",https://www.zillow.com/homedetails/6802-Esmeralda-Dr-Castle-Rock-CO-80108/108401171_zpid/
House for sale,"8511 Brambleridge Dr, Castle Pines, CO 80108","$575,000 ",8511 Brambleridge Dr,Castle Pines,CO,80108,"3,747",https://www.zillow.com/homedetails/8511-Brambleridge-Dr-Castle-Pines-CO-80108/52458888_zpid/
House for sale,"5109 Pine River Trl, Castle Rock, CO 80108","$1,200,000 ",5109 Pine River Trl,Castle Rock,CO,80108,"5,703",https://www.zillow.com/homedetails/5109-Pine-River-Trl-Castle-Rock-CO-80108/82025227_zpid/
House for sale,"6889 Murphy Creek Ln, Castle Pines, CO 80108","$954,900 ",6889 Murphy Creek Ln,Castle Pines,CO,80108,"6,364",https://www.zillow.com/homedetails/6889-Murphy-Creek-Ln-Castle-Pines-CO-80108/118268727_zpid/
