House status,Name,Price,Street Address,Locality,Region,PostalCode,Size,Href
New construction,"The Castlewood Plan, Meadowlark, Parker, CO 80134","$481,990 ","The Castlewood Plan, Meadowlark",Parker,CO,80134,"2,411",https://www.zillow.com/community/meadowlark/2078394152_zpid/
New construction,"Sheridan Plan, Ridgeline At Meridian Village, Parker, CO 80134","$587,950 ","Sheridan Plan, Ridgeline at Meridian Village",Parker,CO,80134,"2,890",https://www.zillow.com/community/ridgeline-at-meridian-village/2078676549_zpid/
House for sale,"5008 Raintree Cir, Parker, CO 80134","$1,700,000 ",5008 Raintree Cir,Parker,CO,80134,"7,831",https://www.zillow.com/homedetails/5008-Raintree-Cir-Parker-CO-80134/81772900_zpid/
House for sale,"10023 S Granite Hill Dr, Parker, CO 80134","$635,000 ",10023 S Granite Hill Dr,Parker,CO,80134,"3,419",https://www.zillow.com/homedetails/10023-S-Granite-Hill-Dr-Parker-CO-80134/2077948415_zpid/
New construction,"Lapis Plan, Seasons At Stonegate, Parker, CO 80134","$524,950 ","Lapis Plan, Seasons at Stonegate",Parker,CO,80134,"2,180",https://www.zillow.com/community/seasons-at-stonegate/2078676566_zpid/
Condo for sale,"12766 Ironstone Way Apt 104, Parker, CO 80134","$260,000 ",12766 Ironstone Way APT 104,Parker,CO,80134,929,https://www.zillow.com/homedetails/12766-Ironstone-Way-APT-104-Parker-CO-80134/63390394_zpid/
New construction,"12942 Washburn Ct, Parker, CO 80134","$649,990 ",12942 Washburn Ct,Parker,CO,80134,"3,181",https://www.zillow.com/homedetails/12942-Washburn-Ct-Parker-CO-80134/249983547_zpid/
New construction,"12751 Randles Ave, Parker, CO 80134","$499,990 ",12751 Randles Ave,Parker,CO,80134,"1,991",https://www.zillow.com/homedetails/12751-Randles-Ave-Parker-CO-80134/249985760_zpid/
New construction,"Daniel Plan, Stone Creek Ranch, Parker, CO 80134","$525,950 ","Daniel Plan, Stone Creek Ranch",Parker,CO,80134,"2,320",https://www.zillow.com/community/stone-creek-ranch/2078676573_zpid/
New construction,"The Platte Plan, Meadowlark, Parker, CO 80134","$462,990 ","The Platte Plan, Meadowlark",Parker,CO,80134,"1,819",https://www.zillow.com/community/meadowlark/2078394151_zpid/
New construction,"Holbrook Plan, Timbers At The Pinery, Parker, CO 80134","$799,950 ","Holbrook Plan, Timbers at the Pinery",Parker,CO,80134,"3,220",https://www.zillow.com/community/timbers-at-pinery/2078676585_zpid/
New construction,"Dillon II Plan, Reata Ridge, Parker, CO 80134","$593,950 ","Dillon II Plan, Reata Ridge",Parker,CO,80134,"3,210",https://www.zillow.com/community/reata-ridge/2078676687_zpid/
New construction,"The Northgate Plan, Meadowlark, Parker, CO 80134","$463,990 ","The Northgate Plan, Meadowlark",Parker,CO,80134,"1,839",https://www.zillow.com/community/meadowlark/2078394154_zpid/
New construction,"Coming Soon Plan, Trails At Crowfoot Town Collection, Parker, CO 80134",,"Coming Soon Plan, Trails at Crowfoot Town Collection",Parker,CO,80134,,https://www.zillow.com/community/trails-at-crowfoot-town-collection/2079291853_zpid/
New construction,"Yorktown Plan, Ridgeline At Meridian Village, Parker, CO 80134","$589,950 ","Yorktown Plan, Ridgeline at Meridian Village",Parker,CO,80134,"2,930",https://www.zillow.com/community/ridgeline-at-meridian-village/2078676552_zpid/
New construction,"Coming Soon Plan, Trails At Crowfoot City Collection, Parker, CO 80134",,"Coming Soon Plan, Trails at Crowfoot City Collection",Parker,CO,80134,,https://www.zillow.com/community/trails-at-crowfoot-city-collection/2079291855_zpid/
House for sale,"10621 Clarkeville Way, Parker, CO 80134","$520,000 ",10621 Clarkeville Way,Parker,CO,80134,"3,828",https://www.zillow.com/homedetails/10621-Clarkeville-Way-Parker-CO-80134/13468046_zpid/
New construction,"Daley Plan, Stone Creek Ranch, Parker, CO 80134","$585,950 ","Daley Plan, Stone Creek Ranch",Parker,CO,80134,"3,470",https://www.zillow.com/community/stone-creek-ranch/2078676578_zpid/
New construction,"Arlington Plan, Ridgeline At Meridian Village, Parker, CO 80134","$553,950 ","Arlington Plan, Ridgeline at Meridian Village",Parker,CO,80134,"1,880",https://www.zillow.com/community/ridgeline-at-meridian-village/2078676550_zpid/
House for sale,"12505 Swansea Dr, Parker, CO 80134","$535,000 ",12505 Swansea Dr,Parker,CO,80134,"2,864",https://www.zillow.com/homedetails/12505-Swansea-Dr-Parker-CO-80134/55812417_zpid/
Condo for sale,"10787 Twenty Mile Rd #307, Parker, CO 80134","$290,000 ",10787 Twenty Mile Rd #307,Parker,CO,80134,"1,063",https://www.zillow.com/homedetails/10787-Twenty-Mile-Rd-307-Parker-CO-80134/63390243_zpid/
House for sale,"11870 S Breeze Grass Way, Parker, CO 80134","$579,000 ",11870 S Breeze Grass Way,Parker,CO,80134,"4,291",https://www.zillow.com/homedetails/11870-S-Breeze-Grass-Way-Parker-CO-80134/82031568_zpid/
New construction,"Coming Soon Plan, Trails At Crowfoot Destination Collection, Parker, CO 80134",,"Coming Soon Plan, Trails at Crowfoot Destination Collection",Parker,CO,80134,,https://www.zillow.com/community/trails-at-crowfoot-destination-collection/2079291869_zpid/
New construction,"The Golden Gate Plan, Meadowlark, Parker, CO 80134","$524,990 ","The Golden Gate Plan, Meadowlark",Parker,CO,80134,"3,147",https://www.zillow.com/community/meadowlark/2078394153_zpid/
New construction,"Hillary Plan, Timbers At The Pinery, Parker, CO 80134","$874,950 ","Hillary Plan, Timbers at the Pinery",Parker,CO,80134,"4,820",https://www.zillow.com/community/timbers-at-pinery/2078676590_zpid/
New construction,"Avril Plan, Stone Creek Ranch, Parker, CO 80134","$525,950 ","Avril Plan, Stone Creek Ranch",Parker,CO,80134,"2,490",https://www.zillow.com/community/stone-creek-ranch/2078676580_zpid/
New construction,"Dearborn Plan, Reata Ridge, Parker, CO 80134","$543,950 ","Dearborn Plan, Reata Ridge",Parker,CO,80134,"2,380",https://www.zillow.com/community/reata-ridge/2078676688_zpid/
House for sale,"8432 Wheatgrass Cir, Parker, CO 80134","$335,000 ",8432 Wheatgrass Cir,Parker,CO,80134,"1,668",https://www.zillow.com/homedetails/8432-Wheatgrass-Cir-Parker-CO-80134/13464346_zpid/
New construction,"Dayton Plan, Timbers At The Pinery, Parker, CO 80134","$804,950 ","Dayton Plan, Timbers at the Pinery",Parker,CO,80134,"3,950",https://www.zillow.com/community/timbers-at-pinery/2078676589_zpid/
New construction,"Residence 2b Plan, The Trails At Westcreek, Parker, CO 80134","$329,990 ","Residence 2B Plan, The Trails at Westcreek",Parker,CO,80134,"1,203",https://www.zillow.com/community/trails-at-westcreek/2079533998_zpid/
Condo for sale,"9461 Ashbury Cir Apt 204, Parker, CO 80134","$280,000 ",9461 Ashbury Cir APT 204,Parker,CO,80134,"1,206",https://www.zillow.com/homedetails/9461-Ashbury-Cir-APT-204-Parker-CO-80134/72298726_zpid/
New construction,"Plan 2390 Modeled Plan, Stone Creek Ranch, Parker, CO 80134","$447,495 ","Plan 2390 Modeled Plan, Stone Creek Ranch",Parker,CO,80134,"2,396",https://www.zillow.com/community/stone-creek-ranch/2079733373_zpid/
New construction,"Daley Plan, Reata Ridge, Parker, CO 80134","$611,950 ","Daley Plan, Reata Ridge",Parker,CO,80134,"3,460",https://www.zillow.com/community/reata-ridge/2078676691_zpid/
House for sale,"17114 E Cedar Gulch Dr, Parker, CO 80134","$470,000 ",17114 E Cedar Gulch Dr,Parker,CO,80134,"2,969",https://www.zillow.com/homedetails/17114-E-Cedar-Gulch-Dr-Parker-CO-80134/118269085_zpid/
House for sale,"16795 Trail Sky Cir, Parker, CO 80134","$598,000 ",16795 Trail Sky Cir,Parker,CO,80134,"2,966",https://www.zillow.com/homedetails/16795-Trail-Sky-Cir-Parker-CO-80134/67450610_zpid/
New construction,"Hemingway Plan, Stone Creek Ranch, Parker, CO 80134","$504,950 ","Hemingway Plan, Stone Creek Ranch",Parker,CO,80134,"2,520",https://www.zillow.com/community/stone-creek-ranch/2078676572_zpid/
New construction,"Crestone (Residence 49204) Plan, Anthology, Parker, CO 80134","$589,990 ","Crestone (Residence 49204) Plan, Anthology",Parker,CO,80134,"3,181",https://www.zillow.com/community/anthology/2080665074_zpid/
House for sale,"5379 Pinyon Jay Rd, Parker, CO 80134","$890,000 ",5379 Pinyon Jay Rd,Parker,CO,80134,"5,714",https://www.zillow.com/homedetails/5379-Pinyon-Jay-Rd-Parker-CO-80134/13480277_zpid/
House for sale,"17040 Motsenbocker Way, Parker, CO 80134","$425,000 ",17040 Motsenbocker Way,Parker,CO,80134,"2,102",https://www.zillow.com/homedetails/17040-Motsenbocker-Way-Parker-CO-80134/13470640_zpid/
New construction,"Signature Series Plan One Plan, Pradera, Parker, CO 80134","$704,950 ","Signature Series Plan One Plan, Pradera",Parker,CO,80134,"2,598",https://www.zillow.com/community/pradera/2081380499_zpid/
New construction,"Daniel Plan, Reata Ridge, Parker, CO 80134","$550,950 ","Daniel Plan, Reata Ridge",Parker,CO,80134,"2,320",https://www.zillow.com/community/reata-ridge/2078676689_zpid/
New construction,"Residence 2a Plan, The Trails At Westcreek, Parker, CO 80134","$319,990 ","Residence 2A Plan, The Trails at Westcreek",Parker,CO,80134,"1,147",https://www.zillow.com/community/trails-at-westcreek/2079533999_zpid/
New construction,"Silverthorne Plan, Stone Creek Ranch, Parker, CO 80134","$500,990 ","Silverthorne Plan, Stone Creek Ranch",Parker,CO,80134,"2,757",https://www.zillow.com/community/stone-creek-ranch/2082165369_zpid/
New construction,"The Waterton Plan, Meadowlark, Parker, CO 80134","$496,990 ","The Waterton Plan, Meadowlark",Parker,CO,80134,"2,666",https://www.zillow.com/community/meadowlark/2078394155_zpid/
New construction,"Plan 1818 Modeled Plan, Stone Creek Ranch, Parker, CO 80134","$421,495 ","Plan 1818 Modeled Plan, Stone Creek Ranch",Parker,CO,80134,"1,860",https://www.zillow.com/community/stone-creek-ranch/2079733368_zpid/
New construction,"The Nederland Plan, Senderos Creek: The Town Collection, Parker, CO 80134","$438,990 ","The Nederland Plan, Senderos Creek: The Town Collection",Parker,CO,80134,"2,014",https://www.zillow.com/community/senderos-creek-town-collection/2082278695_zpid/
New construction,"Darius Plan, Stone Creek Ranch, Parker, CO 80134","$563,950 ","Darius Plan, Stone Creek Ranch",Parker,CO,80134,"2,870",https://www.zillow.com/community/stone-creek-ranch/2078676579_zpid/
New construction,"Daley Plan, Timbers At The Pinery, Parker, CO 80134","$794,950 ","Daley Plan, Timbers at the Pinery",Parker,CO,80134,"3,330",https://www.zillow.com/community/timbers-at-pinery/2078676592_zpid/
New construction,"Granby Plan, Alder Village, Parker, CO 80134","$439,990 ","Granby Plan, Alder Village",Parker,CO,80134,"2,017",https://www.zillow.com/community/alder-village/2082920296_zpid/
New construction,"Willow (Residence 34101) Plan, Anthology, Parker, CO 80134","$424,990 ","Willow (Residence 34101) Plan, Anthology",Parker,CO,80134,"1,756",https://www.zillow.com/community/anthology/2080665073_zpid/
House for sale,"8749 Eagle Moon Way, Parker, CO 80134","$2,150,000 ",8749 Eagle Moon Way,Parker,CO,80134,"7,712",https://www.zillow.com/homedetails/8749-Eagle-Moon-Way-Parker-CO-80134/82028531_zpid/
New construction,"The Clear Creek Plan, Meadowlark, Parker, CO 80134","$506,990 ","The Clear Creek Plan, Meadowlark",Parker,CO,80134,"2,820",https://www.zillow.com/community/meadowlark/2078394156_zpid/
New construction,"Evergreen Plan, Luxury Townhomes At Pine Bluffs, Parker, CO 80134","$404,900 ","Evergreen Plan, Luxury Townhomes at Pine Bluffs",Parker,CO,80134,"2,009",https://www.zillow.com/community/luxury-townhomes-at-pine-bluffs/2085707258_zpid/
New construction,"Plan 1590 Plan, Stone Creek Ranch, Parker, CO 80134","$407,495 ","Plan 1590 Plan, Stone Creek Ranch",Parker,CO,80134,"1,590",https://www.zillow.com/community/stone-creek-ranch/2079733370_zpid/
New construction,"European Hillside Bordeaux Plan, Pradera, Parker, CO 80134","$1,091,950 ","European Hillside Bordeaux Plan, Pradera",Parker,CO,80134,"3,757",https://www.zillow.com/community/pradera/2081380501_zpid/
New construction,"Vail (Residence 39208) Plan, Anthology, Parker, CO 80134","$485,990 ","Vail (Residence 39208) Plan, Anthology",Parker,CO,80134,"2,446",https://www.zillow.com/community/anthology/2080665076_zpid/
New construction,"Cortez Plan, Stone Creek Ranch, Parker, CO 80134","$474,990 ","Cortez Plan, Stone Creek Ranch",Parker,CO,80134,"2,264",https://www.zillow.com/community/stone-creek-ranch/2082165373_zpid/
New construction,"The Castlewood Plan, Senderos Creek: The Canyon Collection, Parker, CO 80134","$518,990 ","The Castlewood Plan, Senderos Creek: The Canyon Collection",Parker,CO,80134,"2,422",https://www.zillow.com/community/senderos-creek-canyon-collection/2086300380_zpid/
New construction,"Coronado Plan, Stone Creek Ranch, Parker, CO 80134","$507,950 ","Coronado Plan, Stone Creek Ranch",Parker,CO,80134,"2,740",https://www.zillow.com/community/stone-creek-ranch/2078676576_zpid/
New construction,"The Buena Vista Plan, Senderos Creek: The Town Collection, Parker, CO 80134","$403,990 ","The Buena Vista Plan, Senderos Creek: The Town Collection",Parker,CO,80134,"1,620",https://www.zillow.com/community/senderos-creek-town-collection/2082278692_zpid/
New construction,"Residence Three Plan, The Timbers At The Pinery By Berkeley Homes, Parker, CO 80134","$804,900 ","Residence Three Plan, The Timbers at the Pinery by Berkeley Homes",Parker,CO,80134,"3,111",https://www.zillow.com/community/timbers-at-pinery-by-berkeley-homes/2087743569_zpid/
New construction,"European Hillside Spazio Plan, Pradera, Parker, CO 80134","$1,167,950 ","European Hillside Spazio Plan, Pradera",Parker,CO,80134,"4,182",https://www.zillow.com/community/pradera/2081380496_zpid/
New construction,"Harmon Plan, Timbers At The Pinery, Parker, CO 80134","$849,950 ","Harmon Plan, Timbers at the Pinery",Parker,CO,80134,"4,390",https://www.zillow.com/community/timbers-at-pinery/2078676586_zpid/
New construction,"Plan 2651 Plan, Stone Creek Ranch, Parker, CO 80134","$452,495 ","Plan 2651 Plan, Stone Creek Ranch",Parker,CO,80134,"2,655",https://www.zillow.com/community/stone-creek-ranch/2079687140_zpid/
New construction,"Estes Plan, Alder Village, Parker, CO 80134","$417,990 ","Estes Plan, Alder Village",Parker,CO,80134,"1,534",https://www.zillow.com/community/alder-village/2082920294_zpid/
New construction,"Estes Plan, Stone Creek Ranch, Parker, CO 80134","$454,990 ","Estes Plan, Stone Creek Ranch",Parker,CO,80134,"1,896",https://www.zillow.com/community/stone-creek-ranch/2082165374_zpid/
New construction,"Stonehaven Plan, Sierra Ridge : The Monarch Collection, Parker, CO 80134","$588,900 ","Stonehaven Plan, Sierra Ridge : The Monarch Collection",Parker,CO,80134,"2,763",https://www.zillow.com/community/sierra-ridge-monarch-collection/2096962949_zpid/
New construction,"Dayton Plan, Reata Ridge, Parker, CO 80134","$631,950 ","Dayton Plan, Reata Ridge",Parker,CO,80134,"3,950",https://www.zillow.com/community/reata-ridge/2078676692_zpid/
New construction,"Bedford Plan, Stone Creek Ranch, Parker, CO 80134","$485,950 ","Bedford Plan, Stone Creek Ranch",Parker,CO,80134,"2,300",https://www.zillow.com/community/stone-creek-ranch/2078676577_zpid/
New construction,"The Perry Park Plan, Senderos Creek: The Town Collection, Parker, CO 80134","$428,990 ","The Perry Park Plan, Senderos Creek: The Town Collection",Parker,CO,80134,"1,920",https://www.zillow.com/community/senderos-creek-town-collection/2082278694_zpid/
New construction,"Conifer Plan, Luxury Townhomes At Pine Bluffs, Parker, CO 80134","$414,900 ","Conifer Plan, Luxury Townhomes at Pine Bluffs",Parker,CO,80134,"2,275",https://www.zillow.com/community/luxury-townhomes-at-pine-bluffs/2085881959_zpid/
New construction,"12852 Randles Ave, Parker, CO 80134","$523,685 ",12852 Randles Ave,Parker,CO,80134,"2,409",https://www.zillow.com/homedetails/12852-Randles-Ave-Parker-CO-80134/249984649_zpid/
New construction,"Aspen (Residence 39209) Plan, Anthology, Parker, CO 80134","$514,990 ","Aspen (Residence 39209) Plan, Anthology",Parker,CO,80134,"2,798",https://www.zillow.com/community/anthology/2080665078_zpid/
New construction,"Genesee Plan, Alder Village, Parker, CO 80134","$444,990 ","Genesee Plan, Alder Village",Parker,CO,80134,"2,199",https://www.zillow.com/community/alder-village/2082920297_zpid/
New construction,"The Clear Creek Plan, Senderos Creek: The Canyon Collection, Parker, CO 80134","$548,990 ","The Clear Creek Plan, Senderos Creek: The Canyon Collection",Parker,CO,80134,"2,835",https://www.zillow.com/community/senderos-creek-canyon-collection/2086300382_zpid/
House for sale,"8460 Wheatgrass Cir, Parker, CO 80134","$375,000 ",8460 Wheatgrass Cir,Parker,CO,80134,"1,576",https://www.zillow.com/homedetails/8460-Wheatgrass-Cir-Parker-CO-80134/13464352_zpid/
New construction,"Residence One Plan, The Timbers At The Pinery By Berkeley Homes, Parker, CO 80134","$809,900 ","Residence One Plan, The Timbers at the Pinery by Berkeley Homes",Parker,CO,80134,"3,473",https://www.zillow.com/community/timbers-at-pinery-by-berkeley-homes/2087743568_zpid/
New construction,"Graham Plan, Sierra Ridge : The Monarch Collection, Parker, CO 80134","$548,900 ","Graham Plan, Sierra Ridge : The Monarch Collection",Parker,CO,80134,"1,974",https://www.zillow.com/community/sierra-ridge-monarch-collection/2096962952_zpid/
New construction,"Plan 1685 Plan, Stone Creek Ranch, Parker, CO 80134","$434,495 ","Plan 1685 Plan, Stone Creek Ranch",Parker,CO,80134,"2,653",https://www.zillow.com/community/stone-creek-ranch/2079733369_zpid/
New construction,"Centennial Plan, Stone Creek Ranch, Parker, CO 80134","$464,990 ","Centennial Plan, Stone Creek Ranch",Parker,CO,80134,"1,990",https://www.zillow.com/community/stone-creek-ranch/2082165370_zpid/
New construction,"The Eldorado Plan, Senderos Creek: The Canyon Collection, Parker, CO 80134","$484,990 ","The Eldorado Plan, Senderos Creek: The Canyon Collection",Parker,CO,80134,"1,713",https://www.zillow.com/community/senderos-creek-canyon-collection/2086300377_zpid/
New construction,"The Palisade Plan, Senderos Creek: The Town Collection, Parker, CO 80134","$413,990 ","The Palisade Plan, Senderos Creek: The Town Collection",Parker,CO,80134,"1,773",https://www.zillow.com/community/senderos-creek-town-collection/2082278693_zpid/
New construction,"Telluride (Residence 39103) Plan, Anthology, Parker, CO 80134","$464,990 ","Telluride (Residence 39103) Plan, Anthology",Parker,CO,80134,"1,936",https://www.zillow.com/community/anthology/2080665088_zpid/
New construction,"Morrison Plan, Alder Village, Parker, CO 80134","$412,990 ","Morrison Plan, Alder Village",Parker,CO,80134,"1,481",https://www.zillow.com/community/alder-village/2082920295_zpid/
New construction,"Delaney Plan, Reata Ridge, Parker, CO 80134","$555,950 ","Delaney Plan, Reata Ridge",Parker,CO,80134,"2,370",https://www.zillow.com/community/reata-ridge/2078676690_zpid/
New construction,"Andrea Plan, Ridgeline At Meridian Village, Parker, CO 80134","$585,950 ","Andrea Plan, Ridgeline at Meridian Village",Parker,CO,80134,"2,880",https://www.zillow.com/community/ridgeline-at-meridian-village/2078676546_zpid/
House for sale,"5811 Regal Oak Ln, Parker, CO 80134","$2,999,000 ",5811 Regal Oak Ln,Parker,CO,80134,"9,254",https://www.zillow.com/homedetails/5811-Regal-Oak-Ln-Parker-CO-80134/121864556_zpid/
New construction,"Hopewell Plan, Stone Creek Ranch, Parker, CO 80134","$505,950 ","Hopewell Plan, Stone Creek Ranch",Parker,CO,80134,"2,680",https://www.zillow.com/community/stone-creek-ranch/2078676575_zpid/
New construction,"Lincoln (Residence 49203) Plan, Anthology, Parker, CO 80134","$579,990 ","Lincoln (Residence 49203) Plan, Anthology",Parker,CO,80134,"3,162",https://www.zillow.com/community/anthology/2080665086_zpid/
For sale by owner,"15705 Savory Cir, Parker, CO 80134","$550,000 ",15705 Savory Cir,Parker,CO,80134,"3,631",https://www.zillow.com/homedetails/15705-Savory-Cir-Parker-CO-80134/108399178_zpid/
New construction,"Residence Two Plan, The Timbers At The Pinery By Berkeley Homes, Parker, CO 80134","$839,900 ","Residence Two Plan, The Timbers at the Pinery by Berkeley Homes",Parker,CO,80134,"3,690",https://www.zillow.com/community/timbers-at-pinery-by-berkeley-homes/2087743570_zpid/
New construction,"Residence 3a Plan, The Trails At Westcreek, Parker, CO 80134","$349,990 ","Residence 3A Plan, The Trails at Westcreek",Parker,CO,80134,"1,318",https://www.zillow.com/community/trails-at-westcreek/2079534000_zpid/
Condo for sale,"12766 Ironstone Way Apt 203, Parker, CO 80134","$269,950 ",12766 Ironstone Way APT 203,Parker,CO,80134,"1,038",https://www.zillow.com/homedetails/12766-Ironstone-Way-APT-203-Parker-CO-80134/63390397_zpid/
New construction,"European Hillside Umbria Plan, Pradera, Parker, CO 80134","$989,950 ","European Hillside Umbria Plan, Pradera",Parker,CO,80134,"2,756",https://www.zillow.com/community/pradera/2081380502_zpid/
New construction,"Plan 1747 Plan, Stone Creek Ranch, Parker, CO 80134","$416,495 ","Plan 1747 Plan, Stone Creek Ranch",Parker,CO,80134,"1,719",https://www.zillow.com/community/stone-creek-ranch/2079733372_zpid/
House for sale,"11979 S Copper Creek Cir, Parker, CO 80134","$599,900 ",11979 S Copper Creek Cir,Parker,CO,80134,"3,879",https://www.zillow.com/homedetails/11979-S-Copper-Creek-Cir-Parker-CO-80134/82028480_zpid/
New construction,"9283 Twenty Mile Rd Unit 406, Parker, CO 80134","$345,320 ",9283 Twenty Mile Rd UNIT 406,Parker,CO,80134,"1,203",https://www.zillow.com/homedetails/9283-Twenty-Mile-Rd-UNIT-406-Parker-CO-80134/2078067630_zpid/
New construction,"9283 Twenty Mile Rd Unit 403, Parker, CO 80134","$333,870 ",9283 Twenty Mile Rd UNIT 403,Parker,CO,80134,"1,147",https://www.zillow.com/homedetails/9283-Twenty-Mile-Rd-UNIT-403-Parker-CO-80134/2078067631_zpid/
New construction,"9283 Twenty Mile Rd Unit 401, Parker, CO 80134","$352,970 ",9283 Twenty Mile Rd UNIT 401,Parker,CO,80134,"1,147",https://www.zillow.com/homedetails/9283-Twenty-Mile-Rd-UNIT-401-Parker-CO-80134/2078067632_zpid/
New construction,"Spruce Plan, Luxury Townhomes At Pine Bluffs, Parker, CO 80134","$394,900 ","Spruce Plan, Luxury Townhomes at Pine Bluffs",Parker,CO,80134,"1,519",https://www.zillow.com/community/luxury-townhomes-at-pine-bluffs/2085707257_zpid/
House for sale,"14044 Touchstone Point, Parker, CO 80134","$610,000 ",14044 Touchstone Point,Parker,CO,80134,"3,505",https://www.zillow.com/homedetails/14044-Touchstone-Point-Parker-CO-80134/119231734_zpid/
New construction,"9283 Twenty Mile Rd Unit 302, Parker, CO 80134","$372,520 ",9283 Twenty Mile Rd UNIT 302,Parker,CO,80134,"1,318",https://www.zillow.com/homedetails/9283-Twenty-Mile-Rd-UNIT-302-Parker-CO-80134/2078067836_zpid/
New construction,"Signature Series Plan Two Plan, Pradera, Parker, CO 80134","$689,950 ","Signature Series Plan Two Plan, Pradera",Parker,CO,80134,"2,811",https://www.zillow.com/community/pradera/2081380498_zpid/
House for sale,"10040 Quarry Hill Pl, Parker, CO 80134","$785,000 ",10040 Quarry Hill Pl,Parker,CO,80134,"4,997",https://www.zillow.com/homedetails/10040-Quarry-Hill-Pl-Parker-CO-80134/13468808_zpid/
New construction,"Hopewell Plan, Ridgeline At Meridian Village, Parker, CO 80134","$570,950 ","Hopewell Plan, Ridgeline at Meridian Village",Parker,CO,80134,"2,680",https://www.zillow.com/community/ridgeline-at-meridian-village/2078676551_zpid/
New construction,"Ashbrook Plan, Sierra Ridge : The Monarch Collection, Parker, CO 80134","$573,900 ","Ashbrook Plan, Sierra Ridge : The Monarch Collection",Parker,CO,80134,"2,574",https://www.zillow.com/community/sierra-ridge-monarch-collection/2096962946_zpid/
New construction,"11388 Iron Ore Ct, Parker, CO 80134","$467,100 ",11388 Iron Ore Ct,Parker,CO,80134,"1,920",https://www.zillow.com/homedetails/11388-Iron-Ore-Ct-Parker-CO-80134/249985101_zpid/
House for sale,"10535 Cottoneaster Way, Parker, CO 80134","$575,000 ",10535 Cottoneaster Way,Parker,CO,80134,"3,209",https://www.zillow.com/homedetails/10535-Cottoneaster-Way-Parker-CO-80134/13469225_zpid/
New construction,"Arlington Plan, Stone Creek Ranch, Parker, CO 80134","$493,950 ","Arlington Plan, Stone Creek Ranch",Parker,CO,80134,"1,880",https://www.zillow.com/community/stone-creek-ranch/2078676569_zpid/
New construction,"9012 Birch Run Dr, Parker, CO 80134","$449,990 ",9012 Birch Run Dr,Parker,CO,80134,"1,534",https://www.zillow.com/homedetails/9012-Birch-Run-Dr-Parker-CO-80134/249985558_zpid/
New construction,"Avon (Residence 39205) Plan, Anthology, Parker, CO 80134","$453,990 ","Avon (Residence 39205) Plan, Anthology",Parker,CO,80134,"1,991",https://www.zillow.com/community/anthology/2080665077_zpid/
New construction,"Signature Series Plan Three Plan, Pradera, Parker, CO 80134","$732,950 ","Signature Series Plan Three Plan, Pradera",Parker,CO,80134,"3,100",https://www.zillow.com/community/pradera/2081380503_zpid/
New construction,"The Waterton Plan, Senderos Creek: The Canyon Collection, Parker, CO 80134","$538,990 ","The Waterton Plan, Senderos Creek: The Canyon Collection",Parker,CO,80134,"2,683",https://www.zillow.com/community/senderos-creek-canyon-collection/2086300379_zpid/
New construction,"Birch (Residence 34203) Plan, Anthology, Parker, CO 80134","$443,990 ","Birch (Residence 34203) Plan, Anthology",Parker,CO,80134,"2,167",https://www.zillow.com/community/anthology/2080665092_zpid/
New construction,"Decker Plan, Stone Creek Ranch, Parker, CO 80134","$500,950 ","Decker Plan, Stone Creek Ranch",Parker,CO,80134,"2,000",https://www.zillow.com/community/stone-creek-ranch/2078676571_zpid/
New construction,"Hawthorn (Residence 34205) Plan, Anthology, Parker, CO 80134","$470,990 ","Hawthorn (Residence 34205) Plan, Anthology",Parker,CO,80134,"2,676",https://www.zillow.com/community/anthology/2080665090_zpid/
New construction,"The Platte Plan, Senderos Creek: The Canyon Collection, Parker, CO 80134","$494,990 ","The Platte Plan, Senderos Creek: The Canyon Collection",Parker,CO,80134,"1,819",https://www.zillow.com/community/senderos-creek-canyon-collection/2086300381_zpid/
